{
  "$schema": "./schemas/architecture.schema.json",
  "$depends_on": [
    "requirements.json"
  ],
  "engagement_id": "eng-2026-003",
  "version": "2.2",
  "last_updated": "2026-03-19",
  "status": "complete",
  "executive_summary": {
    "recommended_approach": "AI-native Python pipeline controlled via Claude Code custom skills. Amazon Nova Canvas (primary) and Titan V2 (fallback) via AWS Bedrock in us-east-1, Pillow for text overlay, S3 for storage, CloudFormation for IaC, GitHub Actions for CI/CD, AWS MCP servers for natural language AWS administration. Designed for AI-assisted development speed and interview-quality demo readiness.",
    "confidence_level": "high",
    "go_no_go": "go",
    "key_benefits": [
      "Claude Code custom skills replace all CLI/argparse interaction \u00e2\u20ac\u201d zero UI development time, better developer experience",
      "Nova Canvas (TIFA 0.897, ImageReward 1.250 per Amazon Nova Technical Report arxiv 2506.12103) available in us-east-1 \u00e2\u20ac\u201d no cross-region dependency",
      "3-tier model strategy: Nova Canvas ($0.04/img) for quality, Titan V2 ($0.01/img) for dev, with exponential retry/backoff",
      "GitHub Actions CI/CD + Claude Code hooks enforce quality automatically \u00e2\u20ac\u201d demonstrates engineering discipline",
      "AWS MCP servers enable natural language AWS administration without leaving Claude Code",
      "Flat JSON + S3 manifest eliminates database complexity \u00e2\u20ac\u201d correct scope for PoC"
    ],
    "key_risks": [
      "Claude Sonnet 4.6 (Anthropic) has an AWS Marketplace product ID \u2014 IAM user requires aws-marketplace:Subscribe for first-invocation auto-enablement. Amazon models (Nova Canvas, Titan V2) have no product ID and auto-enable on first invocation with no console action needed. G-001 gate verifies first invocation succeeds.",
      "AnthropicBedrock client does not auto-read ~/.aws/config for region \u00e2\u20ac\u201d must set AWS_REGION env var or aws_region constructor param",
      "Text overlay via Pillow produces functional but not design-tool-quality typography \u00e2\u20ac\u201d acceptable for PoC",
      "Regulatory text placement on generated images requires coordinate tuning per aspect ratio"
    ],
    "total_investment_range": "Unconstrained \u00e2\u20ac\u201d expected $5-25 GenAI API costs for PoC run. Nova Canvas $0.04/image (quality), Titan V2 $0.01/image (dev). AI-assisted development (Claude Code + Sonnet) handles all implementation."
  },
  "tech_stack": {
    "llm": {
      "provider": "Amazon Bedrock (us-east-1)",
      "primary_model": "Amazon Nova Canvas (amazon.nova-canvas-v1:0)",
      "fallback_model": "Amazon Titan Image Generator V2 (amazon.titan-image-generator-v2:0)",
      "removed_model": "stability.sd3-5-large-v1:0 \u00e2\u20ac\u201d us-west-2 only, no cross-region inference profile, moved to BACKLOG",
      "text_reasoning_model": "Claude Sonnet 4.6 (anthropic.claude-sonnet-4-6)",
      "text_reasoning_client": "AnthropicBedrock(aws_region='us-east-1')",
      "text_reasoning_package": "anthropic[bedrock]",
      "hosting": "AWS Managed (Bedrock)",
      "rationale": "Nova Canvas is the correct primary model: TIFA 0.897, ImageReward 1.250 per Amazon Nova Technical Report (arxiv 2506.12103v1) \u00e2\u20ac\u201d highest available metrics for first-party AWS image models. Only available in us-east-1, which confirms region selection. SD3.5 Large is us-west-2 only with no cross-region inference profile \u00e2\u20ac\u201d removing from design prevents region split. Titan V2 serves as dev/iterate fallback. Claude Sonnet 4.6 via AnthropicBedrock() provides text reasoning for prompt construction and compliance checks \u00e2\u20ac\u201d same IAM credential chain as boto3, cleaner API."
    },
    "orchestration": {
      "framework": "Native Python (no orchestration framework)",
      "version": "N/A",
      "pattern": "pipeline",
      "rationale": "Linear pipeline (parse \u00e2\u2020\u2019 check assets \u00e2\u2020\u2019 construct prompt \u00e2\u2020\u2019 generate \u00e2\u2020\u2019 overlay \u00e2\u2020\u2019 upload \u00e2\u2020\u2019 manifest) is the simplest pattern. No LLM orchestration, RAG, or agent loops. Direct boto3 and anthropic[bedrock] calls. Adding LangChain or similar would be over-engineering for a PoC."
    },
    "backend": {
      "language": "Python 3.12",
      "framework": "Claude Code custom skills (no argparse or Click)",
      "api_style": "rest"
    },
    "frontend": {
      "framework": "Claude Code CLI with custom skills",
      "type": "cli",
      "rationale": "8 custom skills in .claude/skills/ replace all CLI interaction. Skills are invoked from Claude Code, which provides context, argument parsing, and human-readable output. Zero UI development time. Better interview demo experience \u00e2\u20ac\u201d developer can narrate while running /run-pipeline."
    },
    "data_stores": {
      "input_assets": {
        "technology": "Amazon S3",
        "hosting": "AWS us-east-1",
        "purpose": "Brand asset storage \u00e2\u20ac\u201d logos, product photos, templates. Block Public Access enabled.",
        "block_public_access": true
      },
      "output_packaging": {
        "technology": "Amazon S3",
        "hosting": "AWS us-east-1",
        "purpose": "Generated packaging images organized by SKU/Region/format. Block Public Access enabled.",
        "block_public_access": true
      },
      "pipeline_manifest": {
        "technology": "JSON files (local + S3)",
        "hosting": "Local: outputs/runs/, S3: {SKU}/{Region}/manifest.json",
        "purpose": "Run history for /pipeline-status skill. No database required for PoC.",
        "block_public_access": "N/A (S3 bucket inherits Block Public Access)"
      }
    },
    "infrastructure": {
      "cloud_provider": "AWS",
      "compute": "Local Python execution via Claude Code skills (Lambda-ready for future deployment)",
      "container_orchestration": "None (single process)",
      "deployment_strategy": "recreate",
      "region": "us-east-1",
      "region_rationale": "us-east-1 selected because Amazon Nova Canvas (primary image model) is only available in us-east-1. Titan V2 and Claude Sonnet 4.6 also available in us-east-1. SD3.5 Large (us-west-2 only) removed from design \u00e2\u20ac\u201d no cross-region inference profile exists.",
      "monitoring": "CloudWatch basic metrics (PoC scope) + structured JSON logs",
      "logging": "Structured JSON to stdout + pipeline run manifest to S3"
    },
    "ci_cd": {
      "platform": "GitHub Actions",
      "ci_workflow": ".github/workflows/ci.yml \u00e2\u20ac\u201d triggers on every push; runs ruff lint, pytest unit tests, pip-audit",
      "deploy_workflow": ".github/workflows/deploy.yml \u00e2\u20ac\u201d triggers on main push; runs CloudFormation deploy",
      "security": "All action versions pinned to SHA hashes. AWS credentials via GitHub Secrets or OIDC federation.",
      "rationale": "CI/CD is must-have (FR-009). Demonstrates engineering discipline. GitHub Actions is zero-cost for public repos."
    },
    "mcp_servers": {
      "transport": "stdio (uv tool run \u00e2\u20ac\u201d Python packages, not npm)",
      "active_servers": [
        {
          "name": "AWS IaC MCP Server",
          "package": "awslabs.aws-iac-mcp-server@latest",
          "purpose": "CloudFormation and CDK assistance, template validation, cfn-lint, cfn-guard",
          "stdio_command": "uv tool run --from awslabs.aws-iac-mcp-server@latest awslabs.aws-iac-mcp-server.exe"
        },
        {
          "name": "AWS Knowledge MCP Server",
          "package": "Remote HTTP: https://knowledge-mcp.global.api.aws",
          "purpose": "AWS documentation, regional availability, CloudFormation resource knowledge",
          "stdio_command": "uvx fastmcp run https://knowledge-mcp.global.api.aws (fastmcp proxy for stdio clients)"
        }
      ],
      "deprecated_excluded": [
        "aws-cloud-control-api-mcp-server",
        "aws-cdk-mcp-server",
        "aws-terraform-mcp-server"
      ]
    }
  },
  "component_design": [
    {
      "id": "C-001",
      "name": "Claude Code Interface Layer",
      "technology": "Claude Code CLI (.claude/skills/ in target repo)",
      "purpose": "8 custom skills replace all CLI/argparse interaction. Skills provide: pipeline invocation, status display, result viewing, infrastructure operations, health checks, and demo generation. No argparse or Click framework.",
      "skills": [
        {
          "name": "run-pipeline",
          "args": "<sku-brief-path> [--model-tier dev|iterate|final] [--dry-run]",
          "disable_model_invocation": false
        },
        {
          "name": "pipeline-status",
          "args": "",
          "disable_model_invocation": false,
          "note": "read-only, shows recent run manifests"
        },
        {
          "name": "view-results",
          "args": "<sku> [region]",
          "disable_model_invocation": false
        },
        {
          "name": "deploy",
          "args": "[env]",
          "disable_model_invocation": true
        },
        {
          "name": "teardown",
          "args": "[env]",
          "disable_model_invocation": true,
          "note": "requires confirmation"
        },
        {
          "name": "health-check",
          "args": "",
          "disable_model_invocation": false
        },
        {
          "name": "run-tests",
          "args": "",
          "disable_model_invocation": false
        },
        {
          "name": "generate-demo",
          "args": "",
          "disable_model_invocation": false
        }
      ],
      "inputs": [
        "SKU brief JSON file path (for /run-pipeline)",
        "Environment name (for /deploy, /teardown)"
      ],
      "outputs": [
        "Pipeline execution summary",
        "Status tables",
        "S3 output paths",
        "Health check results"
      ],